{
  "$schema": "./event-codemap.schema.json",
  "$comment": "GENERATED by scripts/generate-event-codemap.mjs from schemas/run-event.schema.json + run-event-payloads.schema.json. v2 names are MECHANICAL PROPOSALS (v2 charter C.4 naming rule: domain.verb-ed, kebab, two segments, no reserved core. prefix); `review: true` marks rows needing a semantic decision. Hand fields v2Override / note / status survive regeneration. No consumer reads this in v1.x; the v2 C.4 child RFC edits it and every host backfills from it.",
  "version": 1,
  "updated": "2026-09-02",
  "grammar": "^[a-z][a-z0-9]*(?:-[a-z0-9]+)*\\.[a-z][a-z0-9]*(?:-[a-z0-9]+)*$",
  "counts": {
    "rows": 117,
    "review": 18,
    "overridden": 0
  },
  "rows": [
    {
      "v1": "run.started",
      "v2": "run.started",
      "payloadDef": "runStarted",
      "status": "proposed",
      "review": false,
      "notes": []
    },
    {
      "v1": "run.completed",
      "v2": "run.completed",
      "payloadDef": "runCompleted",
      "status": "proposed",
      "review": false,
      "notes": []
    },
    {
      "v1": "run.failed",
      "v2": "run.failed",
      "payloadDef": "runFailed",
      "status": "proposed",
      "review": false,
      "notes": []
    },
    {
      "v1": "run.cancelled",
      "v2": "run.cancelled",
      "payloadDef": "runCancelled",
      "status": "proposed",
      "review": false,
      "notes": []
    },
    {
      "v1": "run.resuming",
      "v2": "run.resuming",
      "payloadDef": "runResuming",
      "status": "proposed",
      "review": true,
      "notes": [
        "verb is not past-tense — tense is a C.4 decision, not normalised here"
      ]
    },
    {
      "v1": "run.paused",
      "v2": "run.paused",
      "payloadDef": "runPaused",
      "status": "proposed",
      "review": false,
      "notes": []
    },
    {
      "v1": "run.resumed",
      "v2": "run.resumed",
      "payloadDef": "runResumed",
      "status": "proposed",
      "review": false,
      "notes": []
    },
    {
      "v1": "run.restored-from-snapshot",
      "v2": "run.restored-from-snapshot",
      "payloadDef": "runRestoredFromSnapshot",
      "status": "proposed",
      "review": false,
      "notes": []
    },
    {
      "v1": "run.dead_lettered",
      "v2": "run.dead-lettered",
      "payloadDef": "runDeadLettered",
      "status": "proposed",
      "review": false,
      "notes": [
        "case/separator normalised"
      ]
    },
    {
      "v1": "node.started",
      "v2": "node.started",
      "payloadDef": "nodeStarted",
      "status": "proposed",
      "review": false,
      "notes": []
    },
    {
      "v1": "node.completed",
      "v2": "node.completed",
      "payloadDef": "nodeCompleted",
      "status": "proposed",
      "review": false,
      "notes": []
    },
    {
      "v1": "node.failed",
      "v2": "node.failed",
      "payloadDef": "nodeFailed",
      "status": "proposed",
      "review": false,
      "notes": []
    },
    {
      "v1": "node.suspended",
      "v2": "node.suspended",
      "payloadDef": "nodeSuspended",
      "status": "proposed",
      "review": false,
      "notes": []
    },
    {
      "v1": "node.suspend-failed",
      "v2": "node.suspend-failed",
      "payloadDef": "nodeSuspendFailed",
      "status": "proposed",
      "review": false,
      "notes": []
    },
    {
      "v1": "node.resumed",
      "v2": "node.resumed",
      "payloadDef": "nodeResumed",
      "status": "proposed",
      "review": false,
      "notes": []
    },
    {
      "v1": "node.retried",
      "v2": "node.retried",
      "payloadDef": "nodeRetried",
      "status": "proposed",
      "review": false,
      "notes": []
    },
    {
      "v1": "node.skipped",
      "v2": "node.skipped",
      "payloadDef": "nodeSkipped",
      "status": "proposed",
      "review": false,
      "notes": []
    },
    {
      "v1": "node.cancelled",
      "v2": "node.cancelled",
      "payloadDef": "nodeCancelled",
      "status": "proposed",
      "review": false,
      "notes": []
    },
    {
      "v1": "approval.requested",
      "v2": "approval.requested",
      "payloadDef": "approvalRequested",
      "status": "proposed",
      "review": false,
      "notes": []
    },
    {
      "v1": "approval.received",
      "v2": "approval.received",
      "payloadDef": "approvalReceived",
      "status": "proposed",
      "review": false,
      "notes": []
    },
    {
      "v1": "approval.granted",
      "v2": "approval.granted",
      "payloadDef": "approvalGranted",
      "status": "proposed",
      "review": false,
      "notes": []
    },
    {
      "v1": "approval.rejected",
      "v2": "approval.rejected",
      "payloadDef": "approvalRejected",
      "status": "proposed",
      "review": false,
      "notes": []
    },
    {
      "v1": "approval.overridden",
      "v2": "approval.overridden",
      "payloadDef": "approvalOverridden",
      "status": "proposed",
      "review": false,
      "notes": []
    },
    {
      "v1": "clarification.requested",
      "v2": "clarification.requested",
      "payloadDef": "clarificationRequested",
      "status": "proposed",
      "review": false,
      "notes": []
    },
    {
      "v1": "clarification.resolved",
      "v2": "clarification.resolved",
      "payloadDef": "clarificationResolved",
      "status": "proposed",
      "review": false,
      "notes": []
    },
    {
      "v1": "interrupt.requested",
      "v2": "interrupt.requested",
      "payloadDef": "interruptRequested",
      "status": "proposed",
      "review": false,
      "notes": []
    },
    {
      "v1": "interrupt.resolved",
      "v2": "interrupt.resolved",
      "payloadDef": "interruptResolved",
      "status": "proposed",
      "review": false,
      "notes": []
    },
    {
      "v1": "channel.written",
      "v2": "channel.written",
      "payloadDef": "channelWritten",
      "status": "proposed",
      "review": false,
      "notes": []
    },
    {
      "v1": "channel.presence",
      "v2": "channel.presence",
      "payloadDef": "channelPresence",
      "status": "proposed",
      "review": true,
      "notes": [
        "verb is not past-tense — tense is a C.4 decision, not normalised here"
      ]
    },
    {
      "v1": "context.summarized",
      "v2": "context.summarized",
      "payloadDef": "contextSummarized",
      "status": "proposed",
      "review": false,
      "notes": []
    },
    {
      "v1": "artifact.created",
      "v2": "artifact.created",
      "payloadDef": "artifactCreated",
      "status": "proposed",
      "review": false,
      "notes": []
    },
    {
      "v1": "output.chunk",
      "v2": "output.chunk",
      "payloadDef": "outputChunk",
      "status": "proposed",
      "review": true,
      "notes": [
        "verb is not past-tense — tense is a C.4 decision, not normalised here"
      ]
    },
    {
      "v1": "variable.changed",
      "v2": "variable.changed",
      "payloadDef": "variableChanged",
      "status": "proposed",
      "review": false,
      "notes": []
    },
    {
      "v1": "log.appended",
      "v2": "log.appended",
      "payloadDef": "logAppended",
      "status": "proposed",
      "review": false,
      "notes": []
    },
    {
      "v1": "version.pinned",
      "v2": "version.pinned",
      "payloadDef": "versionPinned",
      "status": "proposed",
      "review": false,
      "notes": []
    },
    {
      "v1": "workflow.restored",
      "v2": "workflow.restored",
      "payloadDef": "workflowRestored",
      "status": "proposed",
      "review": false,
      "notes": []
    },
    {
      "v1": "workflow.loopback-limit",
      "v2": "workflow.loopback-limit",
      "payloadDef": "workflowLoopbackLimit",
      "status": "proposed",
      "review": false,
      "notes": []
    },
    {
      "v1": "workflow.stalled",
      "v2": "workflow.stalled",
      "payloadDef": "workflowStalled",
      "status": "proposed",
      "review": false,
      "notes": []
    },
    {
      "v1": "cap.breached",
      "v2": "cap.breached",
      "payloadDef": "capBreached",
      "status": "proposed",
      "review": false,
      "notes": []
    },
    {
      "v1": "lease.acquired",
      "v2": "lease.acquired",
      "payloadDef": "leaseLifecycle",
      "status": "proposed",
      "review": false,
      "notes": []
    },
    {
      "v1": "lease.renewed",
      "v2": "lease.renewed",
      "payloadDef": "leaseLifecycle",
      "status": "proposed",
      "review": false,
      "notes": []
    },
    {
      "v1": "lease.lost",
      "v2": "lease.lost",
      "payloadDef": "leaseLifecycle",
      "status": "proposed",
      "review": false,
      "notes": []
    },
    {
      "v1": "lease.handed-off",
      "v2": "lease.handed-off",
      "payloadDef": "leaseHandedOff",
      "status": "proposed",
      "review": true,
      "notes": [
        "verb is not past-tense — tense is a C.4 decision, not normalised here"
      ]
    },
    {
      "v1": "replay.diverged",
      "v2": "replay.diverged",
      "payloadDef": "replayDiverged",
      "status": "proposed",
      "review": false,
      "notes": []
    },
    {
      "v1": "replay.divergedAtRefusal",
      "v2": "replay.diverged-at-refusal",
      "payloadDef": "replayDivergedAtRefusal",
      "status": "proposed",
      "review": true,
      "notes": [
        "case/separator normalised",
        "verb is not past-tense — tense is a C.4 decision, not normalised here"
      ]
    },
    {
      "v1": "agent.reasoned",
      "v2": "agent.reasoned",
      "payloadDef": "agentReasoned",
      "status": "proposed",
      "review": false,
      "notes": []
    },
    {
      "v1": "agent.reasoning.delta",
      "v2": "agent.reasoning-delta",
      "payloadDef": "agentReasoningDelta",
      "status": "proposed",
      "review": true,
      "notes": [
        "3 segments folded to two",
        "verb is not past-tense — tense is a C.4 decision, not normalised here"
      ]
    },
    {